{
  "$schema": "https://json-schema.org/draft/2020-12/schema",
  "$id": "https://wealth-wire/schemas/trending.schema.json",
  "title": "trending.json",
  "description": "Firms ranked by number of distinct stories mentioning them in the last `days` days.",
  "type": "object",
  "properties": {
    "schema_version": {
      "const": 1
    },
    "generated_at": {
      "type": "string",
      "pattern": "^\\d{4}-\\d{2}-\\d{2}T\\d{2}:\\d{2}:\\d{2}Z$"
    },
    "days": {
      "type": "integer",
      "minimum": 0
    },
    "firms": {
      "type": "array",
      "items": {
        "type": "object",
        "properties": {
          "name": {
            "type": "string"
          },
          "slug": {
            "type": [
              "string",
              "null"
            ],
            "pattern": "^[a-z0-9-]+$"
          },
          "crd": {
            "type": [
              "string",
              "null"
            ]
          },
          "verified": {
            "type": "boolean"
          },
          "stories": {
            "type": "integer",
            "minimum": 1
          }
        },
        "required": [
          "name",
          "slug",
          "crd",
          "verified",
          "stories"
        ],
        "additionalProperties": false
      }
    }
  },
  "required": [
    "schema_version",
    "generated_at",
    "days",
    "firms"
  ],
  "additionalProperties": false
}
